title,abstract,rule_score,zs_playful_prob,playful_zs_flag,rule_norm,ensemble_score,playful_flag
Autoscheduling for sparse tensor algebra with an asymptotic cost model,"While loop reordering and fusion can make big impacts on the constant-factor performance of dense tensor programs, the effects on sparse tensor programs are asymptotic, often leading to orders of magnitude performance differences in practice. Sparse tensors also introduce a choice of compressed storage formats that can have asymptotic effects. Research into sparse tensor compilers has led to simplified languages that express these tradeoffs, but the user is expected to provide a schedule that makes the decisions. This is challenging because schedulers must anticipate the interaction between sparse formats, loop structure, potential sparsity patterns, and the compiler itself. Automating this decision making process stands to finally make sparse tensor compilers accessible to end users. We present, to the best of our knowledge, the first automatic asymptotic scheduler for sparse tensor programs. We provide an approach to abstractly represent the asymptotic cost of schedules and to choose between them. We narrow down the search space to a manageably small Pareto frontier of asymptotically non-dominating kernels. We test our approach by compiling these kernels with the TACO sparse tensor compiler and comparing them with those generated with the default TACO schedules. Our results show that our approach reduces the scheduling space by orders of magnitude and that the generated kernels perform asymptotically better than those generated using the default schedules.",0.0,0.0,False,0.18242552380635635,0.09121276190317817,False
3D-aware Blending with Generative NeRFs,"Image blending aims to combine multiple images seamlessly. It remains challenging for existing 2D-based methods, especially when input images are misaligned due to differences in 3D camera poses and object shapes. To tackle these issues, we propose a 3D-aware blending method using generative Neural Radiance Fields (NeRF), including two key components: 3D-aware alignment and 3D-aware blending. For 3D-aware alignment, we first estimate the camera pose of the reference image with respect to generative NeRFs and then perform pose alignment for objects. To further leverage 3D information of the generative NeRF, we propose 3D-aware blending that utilizes volume density and blends on the NeRF’s latent space, rather than raw pixel space. Collectively, our method outperforms existing 2D baselines, as validated by extensive quantitative and qualitative evaluations with FFHQ and AFHQ-Cat.",0.0,0.0,False,0.18242552380635635,0.09121276190317817,False
Robust Multi-View Hashing for Cross-Modal Retrieval,"Existing hashing methods barely explore the information loss problem during learning the common semantic subspace, thus retrieval performance may be degraded. Besides, these methods mainly rely on the inter-modality or intra-modality correlations separately and fail to exploit the full structure reflected by these correlations. To address these problems, we present a novel cross-modal hashing method, namely Robust Multi-View Hashing (RMVH). To learn a robust latent semantic subspace, we enforce the learnt representations to well reconstruct original features such that more important information can be retained. To comprehensively exploit the relationship between representations of multiple modalities, we utilize Multi-View Learning to construct an affinity matrix to guide the learning of common latent semantic subspace, which can preserve both inter-modality and intra-modality similarities. Instead of relaxing the binary constraints, we leverage the label information to learn hash codes discretely which can avoid the large quantization error and preserve the semantic similarity. Experimental results on three benchmark datasets show that the proposed RMVH achieves superior performance compared with other state-of-the-art methods.",0.0,0.0,False,0.18242552380635635,0.09121276190317817,False
Summarizing Multiple Documents with Conversational Structure for Meta-Review Generation,"We present PeerSum, a novel dataset for generating meta-reviews of scientific papers. The meta-reviews can be interpreted as abstractive summaries of reviews, multi-turn discussions and the paper abstract. These source documents have rich inter-document relationships with an explicit hierarchical conversational structure, cross-references and (occasionally) conflicting information. To introduce the structural inductive bias into pre-trained language models, we introduce Rammer ( Relationship-aware Multi-task Meta-review Generator), a model that uses sparse attention based on the conversational structure and a multi-task training objective that predicts metadata features (e.g., review ratings). Our experimental results show that Rammer outperforms other strong baseline models in terms of a suite of automatic evaluation metrics. Further analyses, however, reveal that RAMMER and other models struggle to handle conflicts in source documents of PeerSum, suggesting meta-review generation is a challenging task and a promising avenue for further research.",0.0,0.0,False,0.18242552380635635,0.09121276190317817,False
Recipe Representation Learning with Networks,"Learning effective representations for recipes is essential in food studies for recommendation, classification, and other applications. Unlike what has been developed for learning textual or cross-modal embeddings for recipes, the structural relationship among recipes and food items are less explored. In this paper, we formalize the problem recipe representation learning with networks to involve both the textual feature and the structural relational feature into recipe representations. Specifically, we first present RecipeNet, a new and large-scale corpus of recipe data to facilitate network based food studies and recipe representation learning research. We then propose a novel heterogeneous recipe network embedding model, rn2vec, to learn recipe representations. The proposed model is able to capture textual, structural, and nutritional information through several neural network modules, including textual CNN, inner-ingredients transformer, and a graph neural network with hierarchical attention. We further design a combined objective function of node classification and link prediction to jointly optimize the model. The extensive experiments show that our model outperforms state-of-the-art baselines on two classic food study tasks. Dataset and codes are available at https://github.com/meettyj/rn2vec.",1.0,0.7184996008872986,True,0.3775406687981454,0.548020134842722,False
Drafting and Revision: Laplacian Pyramid Network for Fast High-Quality Artistic Style Transfer,"Artistic style transfer aims at migrating the style from an example image to a content image. Currently, optimization-based methods have achieved great stylization quality, but expensive time cost restricts their practical applications. Meanwhile, feed-forward methods still fail to synthesize complex style, especially when holistic global and local patterns exist. Inspired by the common painting process of drawing a draft and revising the details, we introduce a novel feed-forward method named Laplacian Pyramid Network (LapStyle). LapStyle first transfers global style patterns in low-resolution via a Drafting Network. It then revises the local details in high-resolution via a Revision Network, which hallucinates a residual image according to the draft and the image textures extracted by Laplacian filtering. Higher resolution details can be easily generated by stacking Revision Networks with multiple Laplacian pyramid levels. The final stylized image is obtained by aggregating outputs of all pyramid levels. Experiments demonstrate that our method can synthesize high quality stylized images in real time, where holistic style patterns are properly transferred.",0.0,0.0,False,0.18242552380635635,0.09121276190317817,False
Teaching-learning of software conceptual design via function-behaviour-structure framework,"Conceptual design is one of the initial phases in software design. In this phase the functional requirements are extracted from the problem and transformed into descriptions of solution concepts. Peculiar characteristics of software conceptual design (scd), such as dynamicity and intangibility add to the complexity of this phase. Modeling using Unified Modeling Language (UML) tools and creating various UML representations often characterize industry practices of scd. Modeling and representations are compartmentalized in UML, i.e. the representations correspond to the solution view of function, behaviour or structure. Novices learn about syntax, semantics and processes to create UML representations in their undergraduate courses such as Software Engineering. However, results from our novice studies indicate that they are unable to create scd due to difficulties such as fixation, lack of integration. These difficulties lead to creation of solutions that are neither integrated nor fulfill all functional requirements. Current teaching-learning methods do not explicitly support novices to overcome these difficulties. In this paper we describe the design of a teaching-learning environment, 'think & link'. It is based on the theoretical design framework of Function-behaviour-structure (FBS). Initial studies with learners using 'think & link' indicate conceptual change in novices understanding of scd.",1.0,0.5771358013153076,False,0.3775406687981454,0.4773382350567265,False
In Situ and Context-Aware Target Apps Selection for Unified Mobile Search,"With the recent growth in the use of conversational systems and intelligent assistants such as Google Assistant and Microsoft Cortana, mobile devices are becoming even more pervasive in our lives. As a consequence, users are getting engaged with mobile apps and frequently search for an information need using different apps. Recent work has stated the need for a unified mobile search system that would act as meta search on users' mobile devices: it would identify the target apps for the user's query, submit the query to the apps, and present the results to the user. Moreover, mobile devices provide rich contextual information about users and their whereabouts. In this paper, we introduce the task of context-aware target apps selection as part of a unified mobile search framework. To this aim, we designed an in situ study to collect thousands of mobile queries enriched with mobile sensor data from 255 users during a three month period. With the aid of this dataset, we were able to study user behavior as they performed cross-app search. We finally study the performance of state-of-the-art retrieval models for this task and propose a simple yet effective neural model that significantly outperforms the baselines. Our neural approach is based on learning high-dimensional representations for mobile apps and contextual information. Furthermore, we show that incorporating context improves the performance by 20% in terms of nDCG@5, enabling the model to perform better for 57% of users. Our data is publicly available for research purposes.",0.0,0.0,False,0.18242552380635635,0.09121276190317817,False
Complex Gated Recurrent Neural Networks,"Complex numbers have long been favoured for digital signal processing, yet complex representations rarely appear in deep learning architectures. RNNs, widely used to process time series and sequence information, could greatly benefit from complex representations. We present a novel complex gated recurrent cell, which is a hybrid cell combining complex-valued and norm-preserving state transitions with a gating mechanism. The resulting RNN exhibits excellent stability and convergence properties and performs competitively on the synthetic memory and adding task, as well as on the real-world tasks of human motion prediction.",0.0,0.0,False,0.18242552380635635,0.09121276190317817,False
Towards Highly Accurate and Stable Face Alignment for High-Resolution Videos,"In recent years, heatmap regression based models have shown their effectiveness in face alignment and pose estimation. However, Conventional Heatmap Regression (CHR) is not accurate nor stable when dealing with high-resolution facial videos, since it finds the maximum activated location in heatmaps which are generated from rounding coordinates, and thus leads to quantization errors when scaling back to the original high-resolution space. In this paper, we propose a Fractional Heatmap Regression (FHR) for high-resolution video-based face alignment. The proposed FHR can accurately estimate the fractional part according to the 2D Gaussian function by sampling three points in heatmaps. To further stabilize the landmarks among continuous video frames while maintaining the precise at the same time, we propose a novel stabilization loss that contains two terms to address time delay and non-smooth issues, respectively. Experiments on 300W, 300VW and Talking Face datasets clearly demonstrate that the proposed method is more accurate and stable than the state-ofthe-art models.",-0.8,0.0,False,0.09112296101485616,0.04556148050742808,False
Diversity vs. Recognizability: Human-like generalization in one-shot generative models,"Robust generalization to new concepts has long remained a distinctive feature of human intelligence. However, recent progress in deep generative models has now led to neural architectures capable of synthesizing novel instances of unknown visual concepts from a single training example. Yet, a more precise comparison between these models and humans is not possible because existing performance metrics for generative models (i.e., FID, IS, likelihood) are not appropriate for the one-shot generation scenario. Here, we propose a new framework to evaluate one-shot generative models along two axes: sample recognizability vs. diversity (i.e., intra-class variability). Using this framework, we perform a systematic evaluation of representative one-shot generative models on the Omniglot handwritten dataset. We first show that GAN-like and VAE-like models fall on opposite ends of the diversity-recognizability space. Extensive analyses of the effect of key model parameters further revealed that spatial attention and context integration have a linear contribution to the diversity-recognizability trade-off. In contrast, disentanglement transports the model along a parabolic curve that could be used to maximize recognizability. Using the diversity-recognizability framework, we were able to identify models and parameters that closely approximate human data.",0.0,0.0,False,0.18242552380635635,0.09121276190317817,False
ESearch: Incorporating Text Corpus and Structured Knowledge for Open Domain Entity Search,"The paper introduces an open domain entity search system called ESearch, which aims at finding a list of relevant entities to an open domain entity search query (a natural language question). The system is built on top of a Wikipedia text corpus, as well as the structured DBPedia knowledge base. Entities are initially ranked by a model which effectively associates context matching (based on the contexts of entities in the unstructured text corpus) and category matching (based on the types of entities in the structured knowledge base). They are ranked further by a re-ranking component supported by blind feedback or user feedback on entities. We show that category matching is critical for the search performance and the re-ranking component can boost the performance largely. Category matching therefore needs some query entity types (especially specific entity types) as input. However, it is often hard for systems to detect specific entity types because users may not be familiar with how the types of desired entities are defined in the structured knowledge base. In ESearch, we design an effective ranking model of entity types to facilitate blind feedback and user feedback on desired entity types for category matching, so that users can effectively perform entity search without the need of explicitly providing any query entity types as inputs.",0.0,0.0,False,0.18242552380635635,0.09121276190317817,False
ESPACE: Accelerating Convolutional Neural Networks via Eliminating Spatial and Channel Redundancy,"
 
 Recent years have witnessed an extensive popularity of convolutional neural networks (CNNs) in various computer vision and artificial intelligence applications. However, the performance gains have come at a cost of substantially intensive computation complexity, which prohibits its usage inresource-limited applications like mobile or embedded devices. While increasing attention has been paid to the acceleration of internal network structure, the redundancy of visual input is rarely considered. In this paper, we make the first attempt of reducing spatial and channel redundancy directly from the visual input for CNNs acceleration. The proposed method, termed ESPACE (Elimination of SPAtial and Channel rEdundancy), works by the following three steps: First, the 3D channel redundancy of convolutional layers is reduced by a set of low-rank approximation of convolutional filters. Second, a novel mask based selective processing scheme is proposed, which further speedups the convolution operations via skipping unsalient spatial locations of the visual input. Third, the accelerated network is fine-tuned using the training data via back-propagation. The proposed method is evaluated on ImageNet 2012 with implementations on two widely adopted CNNs, i.e. AlexNet and GoogLeNet. In comparison to several recent methods of CNN acceleration, the proposed scheme has demonstrated new state-of-the-art acceleration performance by a factor of 5.48* and 4.12* speedup on AlexNet and GoogLeNet, respectively, with a minimal decrease in classification accuracy.
 
",0.0,0.0,False,0.18242552380635635,0.09121276190317817,False
Object Graph Programming,"We introduce Object Graph Programming (OGO), which enables reading and modifying an object graph (i.e., the entire state of the object heap) via declarative queries. OGO models the objects and their relations in the heap as an object graph thereby treating the heap as a graph database: each node in the graph is an object (e.g., an instance of a class or an instance of a metadata class) and each edge is a relation between objects (e.g., a field of one object references another object). We leverage Cypher, the most popular query language for graph databases, as OGO's query language. Unlike LINQ, which uses collections (e.g., List) as a source of data, OGO views the entire object graph as a single""collection"". OGO is ideal for querying collections (just like LINQ), introspecting the runtime system state (e.g., finding all instances of a given class or accessing fields via reflection), and writing assertions that have access to the entire program state. We prototyped OGO for Java in two ways: (a) by translating an object graph into a Neo4j database on which we run Cypher queries, and (b) by implementing our own in-memory graph query engine that directly queries the object heap. We used OGO to rewrite hundreds of statements in large open-source projects into OGO queries. We report our experience and performance of our prototypes.",0.0,0.0,False,0.18242552380635635,0.09121276190317817,False
Solving Explainability Queries with Quantification: The Case of Feature Relevancy,"Trustable explanations of machine learning (ML) models are vital in
high-risk uses of artificial intelligence (AI). Apart from the
computation of trustable explanations, a number of explainability
queries have been identified and studied in recent work. Some of these
queries involve solving quantification problems, either in
propositional or in more expressive logics. This paper investigates
one of these quantification problems, namely the feature relevancy
problem (FRP), i.e.\ to decide whether a (possibly sensitive) feature
can occur in some explanation of a prediction. In contrast with
earlier work, that studied FRP for specific classifiers, this paper
proposes a novel algorithm for the \fprob quantification problem which
is applicable to any ML classifier that meets minor requirements.
Furthermore, the paper shows that the novel algorithm is efficient
in practice. The experimental results, obtained using random forests
(RFs) induced from well-known publicly available datasets,
demonstrate that the proposed solution outperforms existing
state-of-the-art solvers for Quantified Boolean Formulas (QBF) by
orders of magnitude. Finally, the paper also identifies a novel family
of formulas that are challenging for currently state-of-the-art QBF
solvers.",0.0,0.0,False,0.18242552380635635,0.09121276190317817,False
Optimizing the Factual Correctness of a Summary: A Study of Summarizing Radiology Reports,"Neural abstractive summarization models are able to generate summaries which have high overlap with human references. However, existing models are not optimized for factual correctness, a critical metric in real-world applications. In this work, we develop a general framework where we evaluate the factual correctness of a generated summary by fact-checking it automatically against its reference using an information extraction module. We further propose a training strategy which optimizes a neural summarization model with a factual correctness reward via reinforcement learning. We apply the proposed method to the summarization of radiology reports, where factual correctness is a key requirement. On two separate datasets collected from hospitals, we show via both automatic and human evaluation that the proposed approach substantially improves the factual correctness and overall quality of outputs over a competitive neural summarization system, producing radiology summaries that approach the quality of human-authored ones.",0.0,0.0,False,0.18242552380635635,0.09121276190317817,False
Longitudinal Variational Autoencoder,"Longitudinal datasets measured repeatedly over time from individual subjects, arise in many biomedical, psychological, social, and other studies. A common approach to analyse high-dimensional data that contains missing values is to learn a low-dimensional representation using variational autoencoders (VAEs). However, standard VAEs assume that the learnt representations are i.i.d., and fail to capture the correlations between the data samples. We propose the Longitudinal VAE (L-VAE), that uses a multi-output additive Gaussian process (GP) prior to extend the VAE's capability to learn structured low-dimensional representations imposed by auxiliary covariate information, and derive a new KL divergence upper bound for such GPs. Our approach can simultaneously accommodate both time-varying shared and random effects, produce structured low-dimensional representations, disentangle effects of individual covariates or their interactions, and achieve highly accurate predictive performance. We compare our model against previous methods on synthetic as well as clinical datasets, and demonstrate the state-of-the-art performance in data imputation, reconstruction, and long-term prediction tasks.",0.0,0.0,False,0.18242552380635635,0.09121276190317817,False
Learning Treatment Effects in Panels with General Intervention Patterns,"The problem of causal inference with panel data is a central econometric question. The following is a fundamental version of this problem: Let $M^*$ be a low rank matrix and $E$ be a zero-mean noise matrix. For a `treatment' matrix $Z$ with entries in $\{0,1\}$ we observe the matrix $O$ with entries $O_{ij} := M^*_{ij} + E_{ij} + \mathcal{T}_{ij} Z_{ij}$ where $\mathcal{T}_{ij} $ are unknown, heterogenous treatment effects. The problem requires we estimate the average treatment effect $\tau^* := \sum_{ij} \mathcal{T}_{ij} Z_{ij} / \sum_{ij} Z_{ij}$. The synthetic control paradigm provides an approach to estimating $\tau^*$ when $Z$ places support on a single row. This paper extends that framework to allow rate-optimal recovery of $\tau^*$ for general $Z$, thus broadly expanding its applicability. Our guarantees are the first of their type in this general setting. Computational experiments on synthetic and real-world data show a substantial advantage over competing estimators.",0.0,0.0,False,0.18242552380635635,0.09121276190317817,False
Are Vision-Language Transformers Learning Multimodal Representations? A Probing Perspective,"In recent years, joint text-image embeddings have significantly improved thanks to the development of transformer-based Vision-Language models. Despite these advances, we still need to better understand the representations produced by those models. In this paper, we compare pre-trained and fine-tuned representations at a vision, language and multimodal level. To that end, we use a set of probing tasks to evaluate the performance of state-of-the-art Vision-Language models and introduce new datasets specifically for multimodal probing. These datasets are carefully designed to address a range of multimodal capabilities while minimizing the potential for models to rely on bias. Although the results confirm the ability of Vision-Language models to understand color at a multimodal level, the models seem to prefer relying on bias in text data for object position and size. On semantically adversarial examples, we find that those models are able to pinpoint fine-grained multimodal differences. Finally, we also notice that fine-tuning a Vision-Language model on multimodal tasks does not necessarily improve its multimodal ability. We make all datasets and code available to replicate experiments.",0.3,0.0,False,0.23147521650098238,0.11573760825049119,False
