title,abstract,rule_score,zs_playful_prob,playful_zs_flag,rule_norm,ensemble_score,playful_flag
"""Why is 'Chicago' deceptive?"" Towards Building Model-Driven Tutorials for Humans","To support human decision making with machine learning models, we often need to elucidate patterns embedded in the models that are unsalient, unknown, or counterintuitive to humans. While existing approaches focus on explaining machine predictions with real-time assistance, we explore model-driven tutorials to help humans understand these patterns in a train- ing phase. We consider both tutorials with guidelines from scientific papers, analogous to current practices of science communication, and automatically selected examples from training data with explanations. We use deceptive review detection as a testbed and conduct large-scale, randomized human-subject experiments to examine the effectiveness of such tutorials. We find that tutorials indeed improve human performance, with and without real-time assistance. In particular, although deep learning provides superior predictive performance than simple models, tutorials and explanations from simple models are more useful to humans. Our work suggests future directions for human-centered tutorials and explanations towards a synergy between humans and AI.",0.3,0.0,False,0.23147521650098238,0.11573760825049119,False
Improved Speech Representations with Multi-Target Autoregressive Predictive Coding,"Training objectives based on predictive coding have recently been shown to be very effective at learning meaningful representations from unlabeled speech. One example is Autoregressive Predictive Coding (Chung et al., 2019), which trains an autoregressive RNN to generate an unseen future frame given a context such as recent past frames. The basic hypothesis of these approaches is that hidden states that can accurately predict future frames are a useful representation for many downstream tasks. In this paper we extend this hypothesis and aim to enrich the information encoded in the hidden states by training the model to make more accurate future predictions. We propose an auxiliary objective that serves as a regularization to improve generalization of the future frame prediction task. Experimental results on phonetic classification, speech recognition, and speech translation not only support the hypothesis, but also demonstrate the effectiveness of our approach in learning representations that contain richer phonetic content.",0.0,0.0,False,0.18242552380635635,0.09121276190317817,False
Microwalk-CI: Practical Side-Channel Analysis for JavaScript Applications,"Secret-dependent timing behavior in cryptographic implementations has resulted in exploitable vulnerabilities, undermining their security. Over the years, numerous tools to automatically detect timing leakage or even to prove their absence have been proposed. However, a recent study at IEEE S&P 2022 showed that, while many developers are aware of one or more analysis tools, they have major difficulties integrating these into their workflow, as existing tools are tedious to use and mapping discovered leakages to their originating code segments requires expert knowledge. In addition, existing tools focus on compiled languages like C, or analyze binaries, while the industry and open-source community moved to interpreted languages, most notably JavaScript. In this work, we introduce Microwalk-CI, a novel side-channel analysis framework for easy integration into a JavaScript development workflow. First, we extend existing dynamic approaches with a new analysis algorithm, that allows efficient localization and quantification of leakages, making it suitable for use in practical development. We then present a technique for generating execution traces from JavaScript applications, which can be further analyzed with our and other algorithms originally designed for binary analysis. Finally, we discuss how Microwalk-CI can be integrated into a continuous integration (CI) pipeline for efficient and ongoing monitoring. We evaluate our analysis framework by conducting a thorough evaluation of several popular JavaScript cryptographic libraries, and uncover a number of critical leakages.",0.0,0.0,False,0.18242552380635635,0.09121276190317817,False
StageNet: Stage-Aware Neural Networks for Health Risk Prediction,"Deep learning has demonstrated success in health risk prediction especially for patients with chronic and progressing conditions. Most existing works focus on learning disease patterns from longitudinal patient data, but pay little attention to the disease progression stage itself. To fill the gap, we propose a Stage-aware neural Network (StageNet) model to extract disease stage information from patient data and integrate it into risk prediction. StageNet is enabled by (1) a stage-aware long short-term memory (LSTM) module that extracts health stage variations unsupervisedly; (2) a stage-adaptive convolutional module that incorporates stage-related progression patterns into risk prediction. We evaluate StageNet on two real-world datasets and show that StageNet outperforms state-of-the-art models in risk prediction task and patient subtyping task. Compared to the best baseline model, StageNet achieves up to 12% higher AUPRC for risk prediction task on two real-world patient datasets. StageNet also achieves over 58% higher Calinski-Harabasz score (a cluster quality metric) for a patient subtyping task.",0.0,0.0,False,0.18242552380635635,0.09121276190317817,False
"Functional Encryption for Bounded Collusions, Revisited",,1.0,0.7041658163070679,True,0.3775406687981454,0.5408532425526067,False
Controllable Video Captioning With POS Sequence Guidance Based on Gated Fusion Network,"In this paper, we propose to guide the video caption generation with Part-of-Speech (POS) information, based on a gated fusion of multiple representations of input videos. We construct a novel gated fusion network, with one particularly designed cross-gating (CG) block, to effectively encode and fuse different types of representations, e.g., the motion and content features of an input video. One POS sequence generator relies on this fused representation to predict the global syntactic structure, which is thereafter leveraged to guide the video captioning generation and control the syntax of the generated sentence. Specifically, a gating strategy is proposed to dynamically and adaptively incorporate the global syntactic POS information into the decoder for generating each word. Experimental results on two benchmark datasets, namely MSR-VTT and MSVD, demonstrate that the proposed model can well exploit complementary information from multiple representations, resulting in improved performances. Moreover, the generated global POS information can well capture the global syntactic structure of the sentence, and thus be exploited to control the syntactic structure of the description. Such POS information not only boosts the video captioning performance but also improves the diversity of the generated captions. Our code is at: https://github.com/vsislab/Controllable_XGating.",0.0,0.0,False,0.18242552380635635,0.09121276190317817,False
Stitching Infrastructures to Facilitate Telemedicine for Low-Resource Environments,"Telemedicine can potentially transform healthcare delivery in low-resource environments by enabling extension of medical knowledge to remote locations, thus enhancing the efficiency and effectiveness of the larger healthcare infrastructure. However, empirical studies have shown mixed results at best. We present a qualitative investigation of a long-standing telemedicine program operating from Lucknow (Uttar Pradesh, India). Invoking the lenses of human infrastructure and seamful spaces, we highlight the factors that determine the success of this telemedicine program. We identify and describe three important aspects: (1) conceptualizing telemedicine as the connectedness of two nodes rather than doctors and patients alone, (2) identifying the critical 'carrying agent' (local doctors at peripheral nodes) and engaging them in program design and implementation, and (3) ensuring co-creation by engaging patients in the process. Finally, we discuss how our lenses allowed us to recognize the seams made visible through the juxtaposition of the infrastructures at the central and peripheral nodes, and to emphasize the human elements that addressed these seams for ensuring the facilitation of a successful telemedicine program.",0.0,0.0,False,0.18242552380635635,0.09121276190317817,False
Fast and Compact Bilinear Pooling by Shifted Random Maclaurin,"Bilinear pooling has achieved an excellent performance in many computer vision tasks such as fine-grained classification, scene recognition and texture recognition. However, the high-dimension features from bilinear pooling can sometimes be inefficient and prone to over-fitting. Random Maclaurin (RM) is a widely used GPU-friendly approximation method to reduce the dimensionality of bilinear features. However, to achieve good performance, large projection matrices are usually required in practice, making it costly in computation and memory. In this paper, we propose a Shifted Random Maclaurin (SRM) strategy for fast and compact bilinear pooling. With merely negligible extra computational cost, the proposed SRM provides an estimator with a provably smaller variance than RM, which benefits accurate kernel approximation and thus the learning performance. Using a small projection matrix, the proposed SRM achieves a comparable estimation performance as RM based on a large projection matrix, and thus boosts the efficiency. Furthermore, we upgrade the proposed SRM to SRM+ to further improve the efficiency and make the compact bilinear pooling compatible with fast matrix normalization. Fast and Compact Bilinear Network (FCBN) built upon the proposed SRM+ is devised, achieving an end-to-end training. Systematic experiments conducted on four public datasets demonstrate the effectiveness and efficiency of the proposed FCBN.",0.0,0.0,False,0.18242552380635635,0.09121276190317817,False
Multilingual word translation using auxiliary languages,"Current multilingual word translation methods are focused on jointly learning mappings from each language to a shared space. The actual translation, however, is still performed as an isolated bilingual task. In this study we propose a multilingual translation procedure that uses all the learned mappings to translate a word from one language to another. For each source word, we first search for the most relevant auxiliary languages. We then use the translations to these languages to form an improved representation of the source word. Finally, this representation is used for the actual translation to the target language. Experiments on a standard multilingual word translation benchmark demonstrate that our model outperforms state of the art results.",0.0,0.0,False,0.18242552380635635,0.09121276190317817,False
Reforming AMR,,0.0,0.0,False,0.18242552380635635,0.09121276190317817,False
Generalized dynamic cognitive hierarchy models for strategic driving behavior,"While there has been an increasing focus on the use of game theoretic models for autonomous driving, empirical evidence shows that there are still open questions around dealing with the challenges of common knowledge assumptions as well as modeling bounded rationality. To address some of these practical challenges, we develop a framework of generalized dynamic cognitive hierarchy for both modelling naturalistic human driving behavior as well as behavior planning for autonomous vehicles (AV). This framework is built upon a rich model of level-0 behavior through the use of automata strategies, an interpretable notion of bounded rationality through safety and maneuver satisficing, and a robust response for planning. Based on evaluation on two large naturalistic datasets as well as simulation of critical traffic scenarios, we show that i) automata strategies are well suited for level-0 behavior in a dynamic level-k framework, and ii) the proposed robust response to a heterogeneous population of strategic and non-strategic reasoners can be an effective approach for game theoretic planning in AV.",0.0,0.0,False,0.18242552380635635,0.09121276190317817,False
